{"schema_version":"1","analysis_rev":"fx-0001","producer_commit":"w0-fixture","input_artifact_hashes":{},"entities":[{"entity_id":"P1","kind":"person","observations":[{"cam_id":"dashcam","local_track_id":1,"t0_ms":3000,"t1_ms":8000,"method":"bytetrack","conf":0.88}],"association":{"method":"gt","conf":1.0,"valid":[0,10000]}},{"entity_id":"V1","kind":"vehicle","observations":[{"cam_id":"dashcam","local_track_id":2,"t0_ms":1200,"t1_ms":4300,"method":"bytetrack","conf":0.9}],"association":{"method":"gt","conf":1.0,"valid":[0,10000]}}]}
