{"schema_version":"1","analysis_rev":"fx-0001","producer_commit":"w0-fixture","input_artifact_hashes":{},"entities":[{"entity_id":"P1","kind":"person","observations":[{"cam_id":"ceiling_00","local_track_id":1,"t0_ms":0,"t1_ms":10000,"method":"bytetrack","conf":0.9},{"cam_id":"ceiling_04","local_track_id":7,"t0_ms":200,"t1_ms":10000,"method":"bytetrack","conf":0.9},{"cam_id":"eye_00","local_track_id":11,"t0_ms":0,"t1_ms":6000,"method":"bytetrack","conf":0.9},{"cam_id":"eye_00","local_track_id":14,"t0_ms":7000,"t1_ms":10000,"method":"bytetrack","conf":0.9}],"association":{"method":"ground_dist","conf":0.95,"valid":[0,10000]}},{"entity_id":"P2","kind":"person","observations":[{"cam_id":"ceiling_00","local_track_id":2,"t0_ms":0,"t1_ms":10000,"method":"bytetrack","conf":0.9},{"cam_id":"ceiling_04","local_track_id":5,"t0_ms":200,"t1_ms":10000,"method":"bytetrack","conf":0.9},{"cam_id":"eye_00","local_track_id":12,"t0_ms":0,"t1_ms":10000,"method":"bytetrack","conf":0.9}],"association":{"method":"ground_dist","conf":0.95,"valid":[0,10000]}},{"entity_id":"F1","kind":"forklift","observations":[{"cam_id":"ceiling_00","local_track_id":3,"t0_ms":0,"t1_ms":10000,"method":"bytetrack","conf":0.9},{"cam_id":"ceiling_04","local_track_id":6,"t0_ms":200,"t1_ms":10000,"method":"bytetrack","conf":0.9},{"cam_id":"eye_00","local_track_id":13,"t0_ms":0,"t1_ms":10000,"method":"bytetrack","conf":0.9}],"association":{"method":"ground_dist","conf":0.95,"valid":[0,10000]}}]}
